<!ELEMENT BaseDeDonneeSerie     (serie*)>
<!ELEMENT Saison  (Episode)>
<!ATTLIST Saison numberS (1) "1">
<!ELEMENT Episode       (#PCDATA)>
<!ATTLIST Episode numberE (1 | 2 | 3 | 4 | 5 | 6 | 7 | 8 | 9 | 10 | 11) "1">

